,Unnamed: 0,index,text,Summary,url
","The article discusses the concept of Net Present Value (NPV), an analysis tool used in capital budgeting to decide whether to invest in a capital asset. A positive NPV indicates a profitable investment, providing more cash over time than it costs, while a negative NPV indicates a loss-making investment. NPV is calculated by subtracting the present value of outbound cash flows from the present value of inbound cash flows, using a discount rate typically derived from the business’s cost of capital. The article also highlights the advantages of NPV, such as its ability to reduce project cash flows to a single, easily comparable numeric value. However, it does caution that NPV is not a foolproof method, as cash flows estimates can vary, the discount rate may be inappropriate, and adjustments for risk are often guesses. It also notes that NPV only analyzes single investments and does not consider the wider profit generation system.",https://www.accountingtools.com/articles/net-present-value
>>>>>>> Stashed changes
24,24,24,"""5 Methods for Capital Budgeting

Capital budgeting is defined as the process used to determine whether capital assets are worth investing in. Capital assets are generally only a small portion of a company’s total assets, but they are usually long-term investments like new equipment, facilities and software upgrades. By incorporating strategically planned capital budgeting into their financial processes, companies can more effectively determine and prioritize which projects, programs and other investment assets could be most financially beneficial in the long-term. As these assets often only generate tangible returns in the long-term, it is important that practicing finance professionals develop an understanding of the five primary methods of capital budgeting, and how they can be utilized to decide the best course of action when firms are planning their next significant capital investment.

Internal Rate of Return

The internal rate of return calculation is used to determine whether a particular investment is worthwhile by assessing the interest that should be yielded over the course of a capital investment. The ideal internal rate of return for a project should be greater than the cost of capital required for the project, as it can be assumed that the project will be a profitable one.

Net Present Value

Net present value (NPV) is used for the same purpose as the internal rate of return, analyzing the projected returns for a potential investment or project. The net present value represents the difference between the current value of money flowing into the project and the current value of money being spent. A positive net present value implies that the earnings generated by a project or investment will exceed the expected costs of the venture and should be pursued.   

Profitability Index

The profitability index is a capital budgeting tool designed to identify the relationship between the cost of a proposed investment and the benefits that could be produced if the venture was successful. The profitability index employs a ratio that consists of the present value of future cash flows over the initial investment.

Accounting Rate of Return

The accounting rate of return is the projected return that an organization can expect from a proposed capital investment. To discover the accounting rate of return, finance professionals must divide the average profit by the initial investment. 

Payback Period

The payback period is a financial analytical tool that defines the length of time necessary to earn back money that has been invested. 

When employing capital budgeting strategies at their respective businesses, finance professionals have a wide array of tools, formulas, and methods available to them. Yet, even with so many tools and options at hand, it’s important that firms remain mindful of their cash flows and capital assets to ensure that their investments prove profitable in the long-term. This way, companies can reap full benefits of capital budgeting by identifying and prioritizing the large investments, which are most likely to have a long-term impact on the company or organization.

As the nation’s oldest private military college, Norwich University has been a leader in innovative education since 1819. Through its online programs, Norwich delivers relevant and applicable curricula that allow its students to make a positive impact on their places of work and their communities.

Norwich University’s online Master of Business Administration program helps create strong leaders well-versed in business management practices. Students can customize their MBA by choosing a concentration in construction management, finance, organizational leadership, project management, supply chain management & logistics, or energy management.""
<<<<<<< Updated upstream
","The article discusses five implications of capital budgeting methods for finance professionals and companies. Capital budgeting, the process to decide whether investing in capital assets would be beneficial, involves long-term considerations about investments such as equipment, facilities, or software. The five primary techniques explored in this article are the internal rate of return, net present value, profitability index, accounting rate of return, and the payback period. All these methods analyze investment prospects from different perspectives, helping businesses better forecast the long-term impacts of their financial decisions. Even with the robust tools available, firms are advised to stay mindful of their cash flows and capital assets to ensure the soundness of their investments. Norwich University's online MBA program is also mentioned, and it offers various concentration options such as finance and project management that can help professionals enhance their understanding of such financial practices.",https://online.norwich.edu/online/about/resource-library/5-methods-capital-budgeting
=======
","The article explains capital budgeting, a process used by companies to evaluate the worthiness of investing in long-term assets such as equipment, facilities, and software upgrades. This strategic financial planning helps to determine and prioritize financially beneficial projects over the long-term. The article outlines five key methods of capital budgeting: Internal Rate of Return (assesses the interest yielded over the investment period), Net Present Value (analyzes the projected returns of a potential investment), Profitability Index (identifies the cost-benefit relationship of a proposed investment), Accounting Rate of Return (projects the return from a capital investment), and Payback Period (determines the time needed to earn back the invested money). The article emphasizes the importance of careful management of cash flows and capital assets to ensure investments are profitable in the long run. Additionally, the article highlights the online Master of Business Administration program offered by Norwich University.",https://online.norwich.edu/online/about/resource-library/5-methods-capital-budgeting
>>>>>>> Stashed changes
25,25,25,"""What is Financial Modeling?

Financial modeling is one of the most highly valued, but thinly understood, skills in financial analysis. The objective of financial modeling is to combine accounting, finance, and business metrics to create a forecast of a company’s future results.

A financial model is simply a spreadsheet which is usually built in Microsoft Excel, that forecasts a business’s financial performance into the future. The forecast is typically based on the company’s historical performance and assumptions about the future, and requires preparing an income statement, balance sheet, cash flow statement, and supporting schedules (know as a three-statement model).

From there, advanced types of models could be built such as discounted cash flow analysis (DCF model), leveraged buyout (LBO), mergers and acquisitions (M&A), and sensitivity analysis. 

Key Highlights

Financial modeling combines accounting, finance, and business metrics to create a forecast of a company’s future results.

The main goal of financial modeling is to accurately project a company’s future financial performance.

Modeling can be useful for valuing companies, determining whether a company should raise capital or grow the business organically or through acquisitions.

What is a Financial Model Used For?

There are many types of financial models with a wide range of uses. The output of a financial model is used for decision-making and performing financial analysis, whether inside or outside of the company. Financial models are used to make decisions about:

Raising capital (debt and/or equity)
Making acquisitions (businesses and/or assets)
Growing the business organically (e.g., opening new stores, entering new markets, etc.)
Selling or divesting assets and business units
Budgeting and forecasting (planning for the years ahead)
Capital allocation (priority of which projects to invest in)
Valuing a business
Financial statement analysis/ratio analysis
Management accounting

What Software is Best for Financial Modeling?

Excel is used because it is the most flexible and customizable spreadsheet tool available. Other software programs may be too rigid and specialized, whereas Excel knowledge is generally more universal.

Who Builds Financial Models?

The main professionals who build financial models are those in investment banking, equity research, corporate development, FP&A, and accounting (due diligence, transaction advisory, valuations, etc).

How Can You Learn Financial Modeling?

The best way to learn financial modeling is to practice. Taking a professional financial modeling training course also offers a solid base understanding of the relevant concepts and skills. 

How Much Accounting Knowledge is Required for Financial Modeling?

In order to build a financial model, you need a solid understanding of accounting fundamentals. You have to know what all the various accounts mean, how to calculate them, and how they’re connected.""
<<<<<<< Updated upstream
","Financial modeling is a vital but often misunderstood skill in financial analysis that combines accounting, finance, and business metrics to forecast a company's future results. It is accomplished through a spreadsheet, typically in Microsoft Excel, which estimates a business's future financial performance using historical data and assumptions about the future. The use of financial models extends to decisions about capital raising, acquisitions, organic business growth, divestitures, budgeting and forecasting, capital allocation, business valuation, financial statement analysis, and management accounting. The main practitioners of financial modeling are professionals in fields such as investment banking, equity research, and corporate development. To effectively conduct financial modeling, one needs a solid understanding of accounting fundamentals, which can be acquired through self-practice or professional training courses.
",https://corporatefinanceinstitute.com/resources/financial-modeling/what-is-financial-modeling/
=======
","The text discusses the concept of financial modeling, a skill valued in financial analysis for its ability to forecast a company's future results by integrating accounting, finance, and business metrics. A financial model essentially involves creating a spreadsheet, commonly using Microsoft Excel, to project a company's financial performance into the future. This entails preparation of an income statement, balance sheet, cash flow statement, and supporting schedules. The financial model may delve deeper to look at discounted cash flows, leveraged buyouts, mergers and acquisitions, and sensitivity analysis. The data generated are used for important system inputs, such as capital raising, making acquisitions, business growth, selling or divesting assets and business units, forecasting, capital allocation, business valuation, and management accounting. Professionals in sectors like investment banking, equity research, corporate development, FP&A, and accounting typically prepare such models. It requires sound knowledge of accounting fundamentals to be able to construct a financial model, which can be best learned through practice and professional training courses.",https://corporatefinanceinstitute.com/resources/financial-modeling/what-is-financial-modeling/
>>>>>>> Stashed changes
26,27,27,"""Financial Modeling Courses & Training | Build Financial Models Now

Financial modeling is the application of data analysis to predict business performance, manage assets, and track cash flow. Financial modeling is a vital tool, essential for a business to succeed, whether it is a startup or a Fortune 500 company. A financial modeling course on Udemy can familiarize you with the concepts and strategies vital to business success.

What is financial modeling?

Research analysts, investment bankers, accountants, and entrepreneurs use financial modeling to better understand a company’s performance before making important business decisions. Financial models are generated using MS Excel and can help you accomplish a variety of important tasks such as forecasting business performance, budgeting, asset management, and understanding cash flow. Financial modeling requires a keen sense of numbers and data to prepare the best financial reports for yourself or your clients.

What are some examples of financial models and what are they used for?

There are several different types of financial models used by professionals to help them make the best business decisions. Financial models help professionals make important business decisions about raising capital, forecasting business changes and requirements, or what it will take to grow a business. Some examples of these useful financial models are the discounted cash flow (DCF), a valuation method used to determine the worth of investing in a business; leveraged buyout (LBO), which examines the impact of funding an acquisition with debt; and mergers and acquisitions (M&A), a method that analyzes the result of acquiring or merging with another company.

What does an investment banker do?

Investment bankers assist corporations and individual investors by making a variety of critical decisions to best ensure the success of their business and financial growth. Investment bankers work in four areas of the financial services industry: capital markets, advisory, trading and brokerage, and asset management. These banks are not like traditional commercial banks that members of the public use to handle their checking and savings accounts. In fact, the Dodd-Frank Act of 2010 requires a complete separation between investment banking and commercial banking. Investment bankers provide guidance and expertise to corporate clients seeking to issue an IPO (initial public offering) to raise capital that they could use to expand a business, acquire, or merge with another company.

What are the balance sheet, the income statement, and the statement of cash flows?

<<<<<<< Updated upstream
Balance sheets help business owners, investment bankers, and accountants understand the assets of a business. In particular, balance sheets outline what the business owns, or its assets. It also notes what the business owes, or its debt and liabilities. A company’s income statement is just as important as its balance sheet and tells you how much profit a company generated during a particular year. The statement of cash flows is a useful tool for stakeholders and can provide insight into how effectively the organization manages its operations. Businesses use a statement of cash flows to understand a company’s performance, more specifically, to assess a company’s ability to generate cash from operations, financing, and investing.""","The article discusses the importance of financial modeling, a data analysis tool used to predict business performance, manage assets, and track cash flow. The process is essential for both small startups and Fortune 500 companies. Financial modeling, which often relies on tools like Excel, aids in forecasting business performance, budgeting, asset management, and understanding cash flow. Various types of financial models help professionals make crucial business decisions such as raising capital or forecasting business changes. These models include the discounted cash flow (DCF), leveraged buyout (LBO), and mergers and acquisitions (M&A). The article also analyzes the role of investment bankers in areas including capital markets, advisory, trading, and brokerage, and asset management. Lastly, the article outlines the importance of a balance sheet, income statement, and the statement of cash flows in understanding and assessing a company's financial performance and prospects.",https://www.udemy.com/topic/financial-modeling/
=======
Balance sheets help business owners, investment bankers, and accountants understand the assets of a business. In particular, balance sheets outline what the business owns, or its assets. It also notes what the business owes, or its debt and liabilities. A company’s income statement is just as important as its balance sheet and tells you how much profit a company generated during a particular year. The statement of cash flows is a useful tool for stakeholders and can provide insight into how effectively the organization manages its operations. Businesses use a statement of cash flows to understand a company’s performance, more specifically, to assess a company’s ability to generate cash from operations, financing, and investing.""","The article seeks to introduce and explain the concept and importance of financial modeling, a process vital to the success of any business, big or small. It is a tool used to predict business performance, manage assets, and track cash flow. This technique, often implemented using MS Excel, facilitates vital operations such as business forecasting, budgeting, and asset management. Financial models are vital in making important decisions pertaining to capital raising, business expansion, and understanding investment worth. A few named models include the Discounted Cash Flow (DCF), Leveraged Buyout (LBO), and Mergers and Acquisitions (M&A). The article also describes the role of investment bankers, who are responsible for managing vital financial decisions and working in separate areas to conventional banks, as per the Dodd-Frank Act of 2010. Lastly, the text explains the balance sheet (detailing a company's assets and liabilities), income statement (exhibiting a company's annual profit), and statement of cash flows (providing insight into a company's operations), which are all crucial for thorough understanding of a business's performance.",https://www.udemy.com/topic/financial-modeling/
>>>>>>> Stashed changes
27,28,28,"""""""What Is Risk Management in Finance, and Why Is It Important? 

Risk management involves identifying, analyzing, and accepting or mitigating uncertainty in investment decisions. Put simply, it is the process of monitoring and dealing with the financial risks associated with investing. Risk management essentially occurs when an investor or fund manager analyzes and attempts to quantify the potential for losses in an investment, and then takes the appropriate action (or inaction) to meet their objectives and risk tolerance. 

Investment risk is the deviation from an expected outcome. This deviation is expressed in absolute terms or relative to something else like a market benchmark. 

Every investment involves some degree of risk. It can come close to zero for U.S. T-bills or very high for emerging-market equities or real estate in highly inflationary markets. 

Risk management involves identifying and analyzing where risk exists, and making decisions about how to deal with it. It occurs everywhere in the realm of finance. 

Diligent risk management can help reduce the chance of losses while ensuring that financial goals are met. Inadequate risk management, though, can result in severe consequences for companies, individuals, and the economy. 

The following is a list of some of the most common risk management techniques:

Avoidance: This strategy means choosing the safest assets with little to no risks.

Retention: This strategy involves accepting any risks that come your way and acknowledging that they come with the territory.

Sharing: This technique involves two or more parties taking on an agreed-upon portion of the risk. 

Transferring: Risks can be passed on from one party to another. 

Loss Prevention and Reduction: This strategy means that you find ways to minimize your losses by preventing them from spreading to other areas. 

How much volatility an investor should accept depends entirely on their risk tolerance. For investment professionals, it is based on the tolerance of their investment objectives. 

Behavioral finance highlights the imbalance between people's views of gains and losses.

Companies can manage operational risk by identifying and assessing potential risks, measuring them, and putting controls in place to mitigate them. It's also important that corporations monitor their operations and risk management techniques to see if they are working and make changes whenever necessary.

Risk is an important part of the financial world. The word often brings up feelings of negativity since there is the potential for capital and investment loss. But risk isn't always bad because investments that have more risk often come with the biggest rewards. Knowing what the risks are, how to identify them, and employing suitable risk management techniques can help mitigate losses while you reap the rewards.""""""
<<<<<<< Updated upstream
","The article explains the concept and importance of risk management in finance. It addresses how this process involves identifying, analyzing, and dealing with uncertainties in investment decisions in order to predict and handle potential losses, which is paramount in aligning investment outcomes with objectives. Importantly, all financial investments carry some degree of risk, with a scope from almost no risk with U.S. Treasury bills to very high risk with emerging-market equities or real estate in highly inflationary markets. Various risk management techniques are outlined, including avoidance, retention, sharing, transferring, and loss prevention/reduction, among others. The amount of risk an investor should tolerate depends on their risk tolerance while for investment professionals, it aligns with their investment objectives. The role of behavioral finance in highlighting people's biases towards gains and losses is also discussed. Companies could manage operational risks by identifying, assessing, and controlling potential risks and regularly reviewing their strategies—the significance of risk in balancing potential losses and returns and how to strategically manage it is highlighted.",https://www.investopedia.com/terms/r/riskmanagement.asp
=======
","The article explains the concept of risk management in finance and emphasizes its importance. Risk management involves identifying, analyzing and then accepting or mitigating uncertainty in investment decisions. Factors such as an investor's objectives and risk tolerance will influence how they monitor and handle financial risks, which can range from zero for U.S. T-bills to very high for equities in emerging markets or real estate in highly inflationary markets. The article also lists some common risk management techniques such as avoidance, retention, sharing, transferring, and loss prevention and reduction. It mentions that the level of volatility an investor should accept depends on their risk tolerance and investment objectives. The article also notes that while risk often has a negative connotation due to the potential for loss, it is a necessary part of the financial world with the potential for high rewards. Effective risk management can help minimize losses and ensure financial goals are achieved.",https://www.investopedia.com/terms/r/riskmanagement.asp
>>>>>>> Stashed changes
