,Unnamed: 0,index,text,Summary,url
10,10,10,"""""""401k vs. IRA: How to prioritize your savings

401(k) vs. IRA? Use both if you can

How much you save now may determine how comfortable you are in retirement. Combining 401(k)s and IRAs can make it even comfier.

IRAs

Understanding IRAs

What is an IRA?

Pick investments for your IRA

Roth vs. traditional IRAs

401k vs IRA

IRA Roth Conversion

How to convert to a Roth IRA online

401k vs IRA

IRA Roth Conversion

How to convert to a Roth IRA online

If your employer offers a retirement plan, like a 401(k) or 403(b), and will match a percentage of your contributions, you should definitely take advantage of it—after all, it's free money for you. Plus you'll have a tax-deferred account that makes saving a cinch through automatic payroll deduction.

If your employer doesn't offer a plan, then an IRA can be a good start to your retirement savings and another opportunity for your earnings to grow tax-free.

Facts & figures you need to know

401(k)

IRA

Who can participate

Anyone who works for an employer that offers a plan

How much you can invest

If you're under age 50

, your annual contribution limit is $20,500 for 2022 and $22,500 for 2023.

If you're age 50 or older

, your annual contribution limit is $27,000 for 2022 and $30,000 for 2023.

If you're under age 50

, your annual contribution limit is $6,000 for 2022 and $6,500 for 2023.

If you're age 50 or older

, your annual contribution limit is $7,000 for 2022 and $7,500 for 2023.

Get details on IRA contribution limits & deadlines

What you can invest in

Most employers limit you to a preselected list of investment choices.

You can invest in a wide variety of mutual funds, exchange-traded funds (ETFs), and individual stocks and bonds.

Pick investments for your IRA

How to get started

Your employer may automatically enroll you in the plan and offer you an easy way to contribute through automatic payroll deduction.

You can open an IRA on your own through almost any bank, brokerage company, insurance firm, or investment company.

Eligible for both? Go for it

The good news is that you don't necessarily have to think IRA versus 401(k). You can save with both as long as you're qualified and heed contribution and income limits.

Learn how an IRA and a 401(k) can work together

If you're eligible to invest in a 401(k) and an IRA, here's an efficient way to do it:

Enroll in your company's 401(k) and contribute at least the amount that your employer will match.

Contribute the maximum allowed to your IRA.

Go back to your 401(k) plan and contribute beyond the match to the annual maximum allowed, if possible.

We recommend following these steps because an IRA offers more flexibility and choice, giving you a greater chance to diversify your assets and reduce your investment risk.

<<<<<<< Updated upstream
When taking withdrawals from an IRA before age 59½, you may have to pay ordinary income tax plus a 10% federal penalty tax.""""""","The article discusses the benefits of both 401(k) and IRA for retirement savings. It emphasizes that if one's employer offers a retirement plan such as a 401(k), and will match a percentage of contributions, it should be taken advantage of as it provides free money and a tax-deferred account. If there's no employer-provided plan, an IRA is a good way to begin retirement savings, offering an opportunity for earnings to grow tax-free. Contribution limits differ for those under and over age 50 for both plans. The article suggests that if one is eligible, they should invest in both a 401(k) and an IRA. Starting with enrolment in the company's 401(k), contribute at least the match amount, then contribute the maximum to the IRA, and return to the 401(k) to contribute past the match to the annual maximum. This strategy balances the flexibility and choice of the IRA with the employer's matched contributions of the 401(k). Withdrawal rules are mentioned, as well.
",https://investor.vanguard.com/investor-resources-education/iras/401k-vs-ira
=======
When taking withdrawals from an IRA before age 59½, you may have to pay ordinary income tax plus a 10% federal penalty tax.""""""","The article discusses the importance of retirement savings, comparing 401(k) and IRA accounts, and suggesting to utilize both for optimal savings if possible. It highlights that individuals should prioritize 401(k) if their employers offer it and match contributions, because it provides an automatic, tax-deferred saving option. Those without an employer's plan can commence with an IRA, which presents another opportunity for tax-free growth. Various contribution limits are outlined based on age and the year with 401(k) allowing for significantly higher limits than an IRA. Considering flexibility and diversity in investment choices, the IRA seems to offer more compared to the typically preselected options in a 401(k) plan. A strategic approach is suggested for individuals eligible for both accounts: start with the 401(k) to get the employer match, then max out the IRA, and if possible, continue adding to the 401(k) to reach its maximum contribution limit. The article finally cautions that early withdrawals from an IRA may incur a federal penalty tax plus ordinary income tax.",https://investor.vanguard.com/investor-resources-education/iras/401k-vs-ira
>>>>>>> Stashed changes
11,11,11,"""Planning for Retirement: Plan for the Retirement You Want - AARP. Your 12-month countdown to retirement. You’ll be retired at this time next year. Here’s how to do it.

States That Don't Tax Retirement Pensions. Could a move make your money go further?

How Much Can You Contribute to a 401(k) for Retirement? Savers ages 50 and older can save more. 

Biggest Social Security Changes for 2022. Benefits are going up, but so are the Medicare premiums

Saving for Retirement. Single? Nearing Retirement? What You Need To Know. Have a plan, and assemble a team to help execute it

No Money Saved for Retirement? It's Not Too Late. Social Security, home equity lines can help. 

7 Reasons Why You Should Go Ahead and Retire. Hanging on to your job do more harm than good. 

Social Security Calculator — Pre Retirement Estimates. When to apply for benefits — how much you’ll get. 

Plan Your Retirement With AARP's 401(k) Calculator. Use this smart tool to reach your retirement goals. 

How to Start Saving For Retirement at 50. It's never too late to build your nest egg. 

Spending in Retirement. Should I Tap My IRA to Buy a House? How much can you spend in retirement? Make sure your retirement savings outlive you. 

10 Secrets of a Happy Retirement. Wise ways to spend your money and time. 

5 Tips to Make Your Money Last. Adjust your financial plan for success. 

12 States That Don't Tax Retirement Distributions. Could a move make your money go further?

How to Super-Stretch Retirement Dollars. Inflation erodes older adults' buying power.

Discover Best Places to Live and Retire Now. Communities with a lot to offer workers and retirees.

6 Ways to Pass Down Wealth to Your Heirs. Some inherited assets come with costs.

Remarried With Children? 5 Essential Estate Planning Tips. Crucial advice for blended families. 

Investing for Retirement. How to Take Withdrawals When the Market Is Falling. Keep a cash stash to give your stocks time to recover.

New IRS Formula For Required Minimum Distributions. IRS updates how it calculates RMDs.

Can I Plough My RMDs Back Into A Roth IRA? Ed Slott, CPA, answers your IRA questions.

The Retirement Income Quiz You Can’t Afford to Fail. The answers can help you retire more comfortably.

Pros and Cons of Owning a Second Home in Retirement. Rental income and tax breaks come with risks. 

Stop Sabotaging Your Retirement Plan. 5 most common mistakes to avoid.

Find Old 401(k)s and More Money You've Forgotten About. The answers can help you retire more comfortably.

5 Things to Know About Finances When Turning 65. Pivotal decisions — even if you aren't ready to retire.

<<<<<<< Updated upstream
7 Ways To Learn to Live A Little In Retirement. Don't let fear of running out of money ruin retirement.""","The article provides comprehensive advice on retirement planning, covering an array of topics from tax-free pensions in certain states to strategies for sustaining your finances post-retirement. Key themes include the necessary preparations for retirement within a year, understanding contributions to retirement savings plans like a 401(k), and changes in Social Security benefits. The article also emphasizes strategic use of resources like home equity lines for those with no savings and provides guidance on when to tap into retirement accounts. Furthermore, it mentions advantages and disadvantages of owning a second home during retirement, important aspects of estate planning, and how to navigate financial decisions when turning 65. It also delves into the potential of forgotten assets, such as old 401(k)s, and offers insights into maximizing buying power in the face of inflation, and even provides tips for a happy retirement.",https://www.aarp.org/retirement/planning-for-retirement/
=======
7 Ways To Learn to Live A Little In Retirement. Don't let fear of running out of money ruin retirement.""","The article outlines several key themes and concepts for individuals planning for their retirement. It provides advice on how to approach a 12-month countdown to retirement, and highlights certain states that offer pension tax benefits. Key strategies, such as maximizing 401(k) contributions, understanding Social Security changes, and employing home equity lines for those without retirement savings, are extensively discussed. The article also introduces methods to calculate Social Security benefits and the use of AARP's 401(k) calculator to reach retirement goals. Tips for spending, investing, and stretching retirement dollars are given alongside guidelines for estate planning, especially in complex family setups. Last but not least, the importance of avoiding common mistakes and learning to enjoy retirement without fear of financial insufficiency is underscored.",https://www.aarp.org/retirement/planning-for-retirement/
>>>>>>> Stashed changes
12,12,12,"Sure. Below is a trimmed down version of the text which maintains the major themes. 

""Retirement Planning by Age: A Decade by Decade Guide

Here's a decade-by-decade guide to retirement planning

Saving for retirement is the gnarliest of delayed gratification challenges. For most people, Social Security benefits won't cover all the bills in retirement. To land in retirement in solid financial shape, you also want to build your own savings in 401(k) plans and individual retirement accounts.

In your 20s: Cash in on compound growth

Retirement savings goal by the end of this decade: You should aim to save about 1x your salary. Aim to save 10% of your gross salary pronto. Focus on Roth options.

In your 30s: Stay (or get) focused

Retirement savings goal by the end of this decade: You should aim to save about 3x your salary.

In your 40s: Monitor your spending

Retirement savings goal by the end of this decade: You should aim to save about 4x your salary. Be on high alert for lifestyle creep. 

In your 50s: Plan your retirement income

Retirement savings goal by the end of this decade: You should aim to save about 8x your salary. Saving as much as possible remains Job One.

In your 60s: Focus on your age 90-plus future self

Retirement savings goal by the end of this decade: You should aim to save about 10x your salary. You've rounded the bend, with retirement in your sights. The big win this decade is to assume that you will live until 95.

Age-Based Retirement Table Of Contents

1. Introduction

2. In your 20s: Cash in on compound growth

3. In your 30s: Stay (or get) focused

4. In your 40s: Monitor your spending

5. In your 50s: Plan your retirement income

6. In your 60s: Focus on your age 90-plus future self""
<<<<<<< Updated upstream
","The article provides a detailed, decade-by-decade guide to retirement planning. It emphasizes how crucial it is to save for retirement, given that Social Security benefits are likely insufficient to meet all expenses after retirement. In your 20s, it advises to take advantage of compound growth by saving at least 1x of your salary. By your 30s, you should aim to have saved 3x your salary and maintain a clear focus. Heading into your 40s, the prevailing advice is to curb increasing lifestyle expenses and strive to save 4x your salary. During your 50s, it turns more critical to source for a retirement income and you should aim to save 8x your salary. Lastly, in your 60s, the article advises to plan assuming you'll live until 95 and push for a savings goal of 10x your salary. It carefully outlines different strategies for each decade of life, creating a comprehensive retirement planning resource.",https://www.cnbc.com/guide/retirement-planning-decade-by-decade/
=======
","The article ""Retirement Planning by Age: A Decade by Decade Guide"" emphasizes the importance of long-term planning and saving for a stress-free retirement. It presents a strategic approach to save for retirement, characterized by age-specific goals. In your 20s, it advocates utilizing compound growth and initiating retirement savings at 10% of your gross salary. By your 30s, the aim is to have savings that equate to 3x your salary. The advice in the 40s is to guard against lifestyle creep and aim to have 4x of the salary saved. By your 50s, you need to plan your retirement income with an aim to save 8x your salary. Lastly, when you're in your 60s, the focus should shift to financial planning for long-term, assuming longevity until 95, and targeting savings amounting to 10x your salary. The core theme is to start saving early, progressively increase the percentage of savings with age, and plan for a longer life post retirement.",https://www.cnbc.com/guide/retirement-planning-decade-by-decade/
>>>>>>> Stashed changes
13,13,13,"""How to get a handle on debt | Consumer Financial Protection Bureau

There are many steps both big and small to getting a handle on your debt. If you’re unsure where to turn for help or who to trust, you’re not alone. About one in three people have been contacted by a creditor or collector seeking to collect a debt within the past year.

No matter your reasons for changing your financial situation, there are resources available to help you pay off what you owe. If you want to take steps toward any of your financial goals, we’re here to help.

Consider working with a credit counselor. Credit counselors can advise you on ways to manage your money and debt and help you create and follow a budget, which can help you save or pay off a debt. Credit counselors are usually nonprofit organizations.
Then, check on the organization with your state’s attorney general or your local consumer protection agency.

A counselor may:
Offer free educational materials and workshops
Review your budget and come up with a plan to address your money problems
Help you decide which debts to pay first and understand what can happen if you stop making payments
Make an up-front agreement with your creditors to stop collections and not charge you late fees while you are in a debt management program
Develop a debt management plan

Credit counselors usually don’t try to reduce the amount of debt you owe. But they may be able to help lower your payments by having you make payments over a longer period, or they may get your creditors to lower your interest rate.

Beware of debt settlement companies that charge up-front fees in return for promising to settle your debts. Debt settlement companies are different from nonprofit credit counseling organizations. These companies often claim they can make a deal with your creditors to reduce the amount of debt you owe.

Debt settlement companies can be risky; you may end up in more debt than when you started. Not paying your debts while trying to settle them can lower your credit scores, add late fees and interest to your account, or cause creditors or debt collectors to file lawsuits against you.

You should avoid doing business with any debt settlement company that:
Charges any fees before it settles your debts
Tells you to stop communicating with your creditors
Guarantees it can make your debt go away
Tells you it can stop all debt collection calls and lawsuits
Promises you that it can settle all of your debt for a percentage reduction
Promotes a ""new government program"" to bail out personal credit card debt
Guarantees that your unsecured debts can be paid off for pennies on the dollar

Paying off debt can be a long journey. But using this information can get you on track to achieve your financial goals.

<<<<<<< Updated upstream
We have additional information about working with debt collectors, including sample letters you can use for your own situation. You can also submit a complaint about a debt collection issue or call us toll-free at (855) 411-CFPB (2372), Monday through Friday, 8 a.m. to 8 p.m. ET.""","The article from the Consumer Financial Protection Bureau provides advice on managing and overcoming debt. It reveals that many people struggle with debt and that there are resources available to assist them. Among the suggested solutions is hiring a credit counselor, generally part of a nonprofit organization, who can provide advice, help create and adhere to a budget, and develop a debt management plan. They can potentially lower payments by extending the payment period or negotiating lower interest rates with creditors. However, the agency warns against debt settlement companies that require upfront fees and make unrealistic promises about resolving debt. The article underscores the importance of a cautious, well-informed approach to tackling debts and achieving financial goals, and offers additional resources for further guidance.",https://www.consumerfinance.gov/about-us/blog/how-get-handle-debt/
=======
We have additional information about working with debt collectors, including sample letters you can use for your own situation. You can also submit a complaint about a debt collection issue or call us toll-free at (855) 411-CFPB (2372), Monday through Friday, 8 a.m. to 8 p.m. ET.""","The article from the Consumer Financial Protection Bureau provides guidance on how to get a handle on debt. It emphasises that there are resources available to help people become debt-free, including working with a credit counselor, who can provide strategies to manage finances, establish a budget and prioritize repayments. However, the article warns against debt settlement companies that promise to reduce the debt you owe or charge fees before settling your debts, as they may result in increased debt due to non-payment of debts while settling. Instead, one should carry out diligent checks on the company's credibility. The process of becoming debt-free can be lengthy, but the article suggests starting with a measured approach to ultimately achieve financial goals. The bureau also offers further resources and support for managing debt-related issues.",https://www.consumerfinance.gov/about-us/blog/how-get-handle-debt/
>>>>>>> Stashed changes
14,14,14,"""""""Pay Off Debt: Tools and Tips - NerdWallet

Pay Off Debt: Tools and Tips

Learn strategies for whittling down what you owe, and get insight into the best approach depending on your debt load.

Updated Jun 30, 2023

Many or all of the products featured here are from our partners who compensate us. This influences which products we write about and where and how the product appears on a page. However, this does not influence our evaluations. Our opinions are our own. 

There are several options for paying off debt, and that can sometimes feel overwhelming. Here’s how to choose a strategy, and some tools and tips that can help you get out of debt.

Assess your debt load

The best way to get out of debt will depend on how much you owe compared with your income.

Weigh DIY payoff methods

Debt snowball and debt avalanche are two ways you can get out of debt yourself by focusing on either the smallest balance or the highest interest rates first. 

Consider debt consolidation to get out of debt faster

Debt consolidation takes your high-interest debt, like credit card balances, and rolls them into one monthly payment, ideally at a lower interest rate. 

Boost debt payoff with budgeting

If you feel like you don’t have enough money to cut down debt, getting clear on your budget may help. 

Lower your bills

Finding ways to reduce your monthly bills can help to free up more money to put toward debt payoff.

Make more money

If you have the ability, making more money even in the short term can boost your debt repayment plan.

Don’t be afraid of debt relief

<<<<<<< Updated upstream
If you’ve tried budgeting, negotiating your payments and bringing in more cash, all to no avail, you might want to try debt relief.""""""","This article by NerdWallet provides strategies and tips to pay off debts, tailored to one's unique debt load. It presents a spectrum of options for an individual to consider while trying to pay off their debt, including the popular DIY payoff methods like debt snowball and debt avalanche. Debt consolidation is an approach highlighted that could potentially condense high-interest debt into one monthly payment at a lower interest rate. Practical strategies like boosting debt payoff through proper budgeting, finding ways to reduce monthly expenses, and exploring avenues to increase income are also suggested. If all else fails, the article encourages not being afraid of debt relief options. Throughout, it emphasizes the necessity to assess one's debt load and realistically evaluate one’s financial situation for selecting the most effective strategy.",https://www.nerdwallet.com/article/finance/pay-off-debt
=======
If you’ve tried budgeting, negotiating your payments and bringing in more cash, all to no avail, you might want to try debt relief.""""""","The article, ""Pay Off Debt: Tools and Tips"" by NerdWallet, provides strategies and insights on how to effectively reduce debt. It showcases several methods of paying off debt, emphasizing the importance of choosing a strategy that matches your particular debt load and income level. Two self-directed methods are highlighted, the 'debt snowball' and 'debt avalanche' strategies, that prioritize either the smallest balance or the highest interest rates, respectively. The article also advises considering debt consolidation, which involves merging high-interest debt into a single, ideally lower interest, monthly payment. Tips to further aid debt repayment include budgeting and finding ways to lower bills, while methods for increasing income are also suggested. Finally, the author encourages considering debt relief if other strategies have been unsuccessful.",https://www.nerdwallet.com/article/finance/pay-off-debt
>>>>>>> Stashed changes
