,Unnamed: 0,index,text,Summary,url
0,0,0,"""Economic Indicator: Definition and How to Interpret

What Is an Economic Indicator?

An economic indicator is a piece of economic data, usually of macroeconomic scale, that is used by analysts to interpret current or future investment possibilities. These indicators also help to judge the overall health of an economy. Economic indicators can be anything the investor chooses, but specific pieces of data released by the government and non-profit organizations have become widely followed. Such indicators include but aren't limited to the Consumer Price Index (CPI), gross domestic product (GDP), and unemployment figures.

Key Takeaways

An economic indicator is a macroeconomic measurement used by analysts to understand current and future economic activity and opportunity.

The most widely-used economic indicators come from data released by the government and non-profit organizations or universities.

Indicators can also be lagging, which means they report economic circumstances but only after the circumstance has materialized.

Indicators can give investors insight as to how trades may play out, though unreliability of data and inconsistency of variables may yield indicators less helpful.

Types of Economic Indicators

Economic indicators can be divided into categories or groups. Most of these economic indicators have a specific schedule for release, allowing investors to prepare for and plan on seeing certain information at certain times of the month and year.

Leading Indicators

Leading indicators, such as the yield curve, consumer durables, net business formations, and share prices, are used to predict the future movements of an economy. The numbers or data on these financial guideposts will move or change before the economy, thus their category's name. Consideration of the information from these indicators must be taken with a grain of salt, as they can be incorrect.

Coincident Indicators

Coincident indicators, which include such things as GDP, employment levels, and retail sales, are seen with the occurrence of specific economic activities. This class of metrics shows the activity of a particular area or region. These types of indicators also allow for policymakers to leverage real data without delay to make informed decisions.

Lagging Indicators

Lagging indicators, such as gross national product (GNP), CPI, unemployment rates, and interest rates, are only seen after a specific economic activity occurs. As the name implies, these data sets show information after the event has happened. This trailing indicator is a technical indicator that comes after large economic shifts.

Interpreting Economic Indicators

An economic indicator is only useful if one interprets it correctly. History has shown strong correlations between economic growth, as measured by GDP, and corporate profit growth. However, determining whether a specific company may grow its earnings based on one indicator of GDP is nearly impossible. 

The Stock Market As an Indicator

Leading indicators forecast where an economy is headed. One of the top leading indicators is the stock market itself. Though not the most critical leading indicator, it’s the one that most people look at. Because stock prices factor in forward-looking performance, the market can indicate the economy’s direction, if earnings estimates are accurate.

Advantages and Disadvantages of Economic Indicators

Pros of Economic Indicators

Economic indicators rely on data to substantiate predictions of what is to come in the future. When analyzed correctly, investors can capitalize on data to make successful trades or correctly assess future market conditions.

Cons of Economic Indicators

The obvious downside to economic indicators, at least leading or coincident indicators, is that they rely on some degree of forecasting. Therefore, economic indicators do not always predict the future correctly, and the recommended action to take may not play out as expected.

What Is the Most Important Economic Indicator?

For many, a country's GDP usually represents the best overall picture of a country's economic health.

Is Inflation an Economic Indicator?

Yes, inflation is a lagging indicator that is reported after a rise in prices has occurred.

What Are the Economic Indicators of a Strong Economy?

An economy may be strong if it has a robust amount of economic activity, and job growth.

Do Traders Use Economic Indicators?

Traders and investment professionals may use economic indicators to predict how broad economic policy will impact their trades or investment strategy.

The Bottom Line

Economic indicators are leading, coincident, or lagging figures that indicate broad conditions. Economic indicators such as GDP, unemployment, inflation, or certain prices inform economics, companies, and investors of not only where the economy is today but perhaps where the economy may be headed. Economic indicators can be used to guide government policy or set investment strategies.""
<<<<<<< Updated upstream
","The article aims to explain the concept of economic indicators, their significance, their types, and their pros and cons. Economic indicators are data related to the macroeconomic scale that provide insights into current or future investment opportunities and the general health of an economy. Notably used economic indicators are GDP, CPI, and unemployment numbers. They can either be leading, coincident, or lagging, with each serving specific functions in economic forecasting. For instance, leading indicators, like share prices, predict future economic movements, while coincident indicators, like GDP, coincide with particular economic activities. Conversely, lagging indicators, like unemployment rates, are perceived only after specific economic activities occur. These indicators may be beneficial for investors and policymakers, but they can also be unreliable due to the inherent uncertainty of forecasting. Generally, the GDP serves as a comprehensive overview of a country's economic health, but other indicators like inflation and job growth are also significant. These economic indicators can assist traders and policymakers in making informed decisions based on the projected economic climate.",https://www.investopedia.com/terms/e/economic_indicator.asp
=======
","The article discusses economic indicators, which are macroeconomic measurements used by analysts to understand current and future economic activity and opportunities. These indicators can derive from various data, such as the Consumer Price Index (CPI), gross domestic product (GDP), and unemployment figures. Economic indicators can be categorized into leading, coincident, and lagging indicators. Leading indicators predict future movements of an economy, while coincident indicators report specific economic activities and lagging indicators reveal information after an economic event has occurred. Interpreting economic indicators correctly is crucial for understanding and predicting economic growth and corporate profit growth. Although economic indicators can provide useful insights, they rely on forecasting and may not always predict the future accurately. Despite their limitations, they are valuable tools for traders, investment professionals, companies, and government bodies in developing economic policy or investment strategies.",https://www.investopedia.com/terms/e/economic_indicator.asp
>>>>>>> Stashed changes
1,1,1,"""Economic Indicators You Should Know for Investment

Economic indicators are some of the most valuable tools investors can place in their arsenals. Metrics such as the Consumer Price Index (CPI) and written reports like the Beige Book are free for all investors to inspect and analyze. Policymakers, notably those at the Federal Reserve, use indicators to determine not only where the economy is going, but how fast it's getting there.

While these reports are often dry and data is raw, they still contains valuable information. It takes understanding how these indicators are calculated and their relative strengths and limitations, but then they can contribute to more thorough decision making. Knowing what the expectations are for any individual release is helpful, as well as knowing the macroeconomic forecasts. It can be beneficial to read a report that analyzes the indicator data through the filters of analyst expectations, seasonality figures, and year-over-year results. Investment advisors might also analyze recently released indicators.

Inflation indicators such as the Producer Price Index (PPI) and the Consumer Price Index (CPI) are vital in determining prevailing interest rates and investing strategies. For example, many investors will use the PPI to try and predict the upcoming CPI. Economic Output indicators like the gross domestic product (GDP) are significant, especially to equity investors focused on corporate profit growth.

The Institute for Supply Management's PMI report contains timely data and is ideal for investors. The relative order in which the indicators are presented does not change month to month, so investors might want to mark their calendars to inspect the areas of the economy that might change how they think about their investments or time horizon.

<<<<<<< Updated upstream
In conclusion, by becoming knowledgeable about the major economic indicators, investors can better understand the stock market and the economy in which their dollars are invested. While there is no one ""magic indicator"" that can dictate whether to buy or sell, using economic indicator data in conjunction with standard asset and securities analysis can lead to smarter portfolio management.""","This article focuses on the importance of economic indicators in investment decisions. It highlights that figures such as the Consumer Price Index (CPI) and written reports like the Beige Book offer valuable insights. These resources, which are often used by institutions like the Federal Reserve to gauge the direction and pace of the economy, can contribute significantly to informed decision-making. By understanding how these indicators work, their strengths and limitations, and the broader economic forecasts, investors can make better judgments. Moreover, reports analyzing these data driven by analyst expectations, seasonality figures, and year-over-year results can be crucial tools. It underscores that the Producer Price Index (PPI), CPI, and Gross Domestic Product (GDP) indicators are vital to understanding interest rates and devising investment strategies. The article also suggests the PMI report from the Institute for Supply Management as a reliable source of timely data. Finally, the article asserts that while no single indicator can predict investment outcomes, using economic indicator data along with standard assets and securities analysis can lead to smarter portfolio management.",https://www.investopedia.com/articles/basics/07/economic_indicators.asp
=======
In conclusion, by becoming knowledgeable about the major economic indicators, investors can better understand the stock market and the economy in which their dollars are invested. While there is no one ""magic indicator"" that can dictate whether to buy or sell, using economic indicator data in conjunction with standard asset and securities analysis can lead to smarter portfolio management.""","The article discusses the importance of economic indicators for investors, emphasizing tools like the Consumer Price Index (CPI) and the Beige Book. These resources are employed by policymakers, particularly those at the Federal Reserve, to analyze the trajectory and pace of the economy. Although these reports may appear dense and raw, they hold significant value for those who understand how to interpret them. Key aspects to note include analyst expectations, macroeconomic forecasts, and year-over-year results. The article additionally highlights the role of inflation indicators such as the CPI and Producer Price Index (PPI) for determining interest rates and investment strategies. It touches on economic output indicators like the gross domestic product (GDP), and cites the Institute for Supply Management's PMI report as a beneficial resource for investors. Altogether, by learning to employ these major economic indicators, investors can gain a deeper understanding of the stock market and economy, leading to more informed portfolio management.
",https://www.investopedia.com/articles/basics/07/economic_indicators.asp
>>>>>>> Stashed changes
2,2,2,"""Financial Markets: Role in the Economy, Importance, Types, and Examples

Financial markets refer broadly to any marketplace where securities trading occurs, including the stock market, bond market, forex market, and derivatives market. Financial markets are vital to the smooth operation of capitalist economies.

Financial markets refer broadly to any marketplace where the trading of securities occurs.

There are many kinds of financial markets, including (but not limited to) forex, money, stock, and bond markets.

These markets may include assets or securities that are either listed on regulated exchanges or trade over-the-counter (OTC).

Financial markets trade in all types of securities and are critical to the smooth operation of a capitalist society.

When financial markets fail, economic disruption, including recession and rising unemployment, can result.

Understanding the Financial Markets

Financial markets play a vital role in facilitating the smooth operation of capitalist economies by allocating resources and creating liquidity for businesses and entrepreneurs. The markets make it easy for buyers and sellers to trade their financial holdings.

The stock market is just one type of financial market. Financial markets are created when people buy and sell financial instruments, including equities, bonds, currencies, and derivatives. Financial markets rely heavily on informational transparency to ensure that the markets set prices that are efficient and appropriate.

Prices of securities traded in the financial markets may not necessarily reflect their intrinsic value.

Types of Financial Markets

There are several different types of markets.

Stock Markets

Equities markets, are used by companies to raise capital and by investors to search for returns. 

Over-the-Counter Markets

An over-the-counter (OTC) market is a decentralized market—meaning it does not have physical locations, and trading is conducted electronically—in which market participants trade securities directly (meaning without a broker).

Bond Markets

A bond is a security in which an investor loans money for a defined period at a pre-established interest rate. Bonds are issued by corporations as well as by municipalities, states, and sovereign governments to finance projects and operations.

Money Markets

Typically, the money markets trade in products with highly liquid short-term maturities (less than one year) and are characterized by a high degree of safety and a relatively lower interest return than other markets.

Derivatives Markets

A derivative is a contract between two or more parties whose value is based on an agreed-upon underlying financial asset (like a security) or set of assets (like an index).

Forex Market

The forex (foreign exchange) market is where participants can buy, sell, hedge, and speculate on the exchange rates between currency pairs. 

Commodities Markets

Commodities markets are venues where producers and consumers meet to exchange physical commodities such as agricultural products (e.g., corn, livestock, soybeans), energy products (oil, gas, carbon credits), precious metals (gold, silver, platinum), or ""soft"" commodities (such as cotton, coffee, and sugar).

Cryptocurrency Markets

Thousands of cryptocurrency tokens are available and traded globally across a patchwork of independent online crypto exchanges.

Examples of Financial Markets

The above sections make clear that the ""financial markets"" are broad in scope and scale. To give two more concrete examples, we will consider the role of stock markets in bringing a company to IPO and the role of the OTC derivatives market in the 2008-09 financial crisis.

<<<<<<< Updated upstream
Financial markets provide liquidity, capital, and participation that are essential for economic growth and stability. Without financial markets, capital could not be allocated efficiently, and economic activity such as commerce and trade, investments, and growth opportunities would be greatly diminished.""","The article discusses the role, importance, types, and examples of financial markets in a capitalist economy. The financial market refers to any marketplace where securities are traded such as stocks, bonds, forex, and derivatives. These markets are crucial to the economy as they facilitate the smooth operation of the economy by allocating resources and creating liquidity for businesses and entrepreneurs. The article also discusses different types of markets, including stock markets, over-the-counter markets (OTC), bond markets, money markets, derivatives markets, forex markets, commodities markets, and cryptocurrency markets. Each of these market types has its unique characteristics and role in the financial world. The article ends by stating that financial markets are critical for economic growth and stability as they provide the essential elements of liquidity, capital, and participation. In their absence, the efficiency of capital allocation and economic activity would be significantly reduced.",https://www.investopedia.com/terms/f/financial-market.asp
=======
Financial markets provide liquidity, capital, and participation that are essential for economic growth and stability. Without financial markets, capital could not be allocated efficiently, and economic activity such as commerce and trade, investments, and growth opportunities would be greatly diminished.""","The article explores the crucial role of financial markets in capitalist economies, focusing on different types of markets and their importance. Financial markets are platforms for securities trading such as stock, bond, forex, and derivatives markets. They ensure the smooth running of the economy by allocating resources and generating business liquidity. Various types of these markets include stock markets (where companies raise capital and investors seek returns); Over-the-Counter (OTC) markets (decentralized, brokerless electronic trading platforms); Bond markets (where investors loan money for a given period at a predefined interest rate); Money markets (which mainly deal in low-interest products with short-term maturities and high-liquidity); Derivatives markets (based on underlying financial assets); Forex markets (for currency exchange); Commodities markets (for trading physical commodities); and Cryptocurrency markets. Market disruptions can lead to economic problems like recessions and rising unemployment. The article notes that financial markets are crucial for economic growth by ensuring efficient capital allocation and facilitating activities such as trades, investments, and opportunities for growth.",https://www.investopedia.com/terms/f/financial-market.asp
>>>>>>> Stashed changes
3,3,3,"""""""Economic News - MarketWatch

China has many vulnerabilities for the U.S. to exploit — though America’s own weaknesses make that harder

The Fed’s narrow view of inflation threatens to snatch defeat from the jaws of economic victory

With U.S.-China relations lacking, Biden and Xi pick the low-hanging fruit

Fed’s Nov. meeting minutes highlight of next week’s Washington’s economic radar

Elon Musk promoting antisemitic post was ‘abhorrent,’ White House says

How a second set of Trump tax cuts could jack up the national debt

I’m 54 and can retire in 2 years with a $6,000-a-month pension and $800,000 in my 401(k). I want to move to Florida. Who can help?

IBM’s new 401(k) strategy could threaten retirement plans for its workers

Freelance AI 'expert' could be the next job in demand

I inherited $246,000 from my late mother and used $142,000 to pay off our mortgage. If we divorce, can I claim this money back from my husband?

I’m 60 with $6,100-a-month in Social Security disability and a pension. I want my money to work for 20 years — what do you recommend?

The latest on inflation

Investors are thrilled inflation is down. Consumers aren’t so happy. Here’s why.

What is deflation? It’s not a one-time price discount — and it’s not something to cheer, economists say.

Inflation in the U.S. tamped down by falling cost of imports

Dow closes at 3-month high as investors weigh data on retail sales, inflation

Economic Report

U.S. housing starts rise ‘unexpectedly’ for the second straight month

Philadelphia Fed manufacturing index continues long trend in contractionary territory

Mortgage rates fall for the third week in a row. ‘There is room’ for rates to drop further, one economist says.

Builder-confidence index falls for the fourth month in a row

Jobless claims climb to three-month high of 231,000 in sign labor market is cooling

The Federal Reserve

Fed’s Collins won’t take additional rate hikes off the table

Fed’s Daly says it makes sense to wait on interest-rate policy given all the uncertainty

Fed’s Mester says markets’ focus on interest-rate cuts is premature

Fed’s Cook says a soft landing is possible, but not assured

Washington Watch

Here’s how the Republican presidential candidates say they’ll tackle student debt

Senate passes bill to avert government shutdown, sending it to Biden to get signed into law

How the Biden-Xi meeting in San Francisco could help prevent a world war

<<<<<<< Updated upstream
Economists embrace notion of ‘no landing’ for economy in 2024""""""","The article covers a wide range of economic news mainly focused on the U.S. Topics mentioned include the vulnerabilities of China and the U.S., the Fed’s narrow outlook on inflation, tense U.S.-China relations, potential tax cuts from Trump, and implications of IBM’s new 401(k) strategy among others. The article also mentions quotes and insights from key individuals like Elon Musk and President Biden. It delves into the topic of inflation, featuring investor reactions and the impact of falling cost of imports while explaining the concept of deflation. Reports on trends in the housing market, manufacturing, mortgage rates, and jobless claims form part of the economic report. The financial policy of the Federal Reserve, including perspectives from various Fed officers, is also discussed. The article ends with Washington Watch which mentions significant political news such as the Republican presidential candidates' stand on student debt, a bill to avert government shutdown, and the diplomatic implications of the Biden-Xi meeting.",https://www.marketwatch.com/economy-politics
=======
Economists embrace notion of ‘no landing’ for economy in 2024""""""","This article from MarketWatch covers a wide range of economic news. It mentions the vulnerabilities China has that the U.S. can exploit, but also recognises America's own weaknesses. It critiques the Federal Reserve's narrow view of inflation and expresses concern over the potential negative impact of another set of Trump's tax cuts on the national debt. There is discussion around U.S.-China relations, artificial intelligence in freelancing, retirement plans, the implications of divorce on inheritance, and recommendations for making money work for the long term. The latter part of the summary discusses inflation and deflation, housing starts, the state of the labor market, and perspectives from various officials in the Federal Reserve on interest rates. Finally, it includes updates from Washington, touching on topics like tackling student debt, government shutdowns, and the implications of the Biden-Xi meeting.
",https://www.marketwatch.com/economy-politics
>>>>>>> Stashed changes
