,Unnamed: 0,index,text,Summary,url
32,38,38,"""Forex (FX): Definition, How to Trade Currencies, and Examples

What Is Forex (FX)?

Forex (FX) refers to the global electronic marketplace for trading international currencies and currency derivatives. It has no central physical location, yet the forex market is the largest, most liquid market in the world by trading volume, with trillions of dollars changing hands every day. Most of the trading is done through banks, brokers, and financial institutions.

The forex market is open 24 hours a day, five days a week, except for holidays. Its name, forex, is a portmanteau of foreign and exchange. It's often abbreviated as fx.

Understanding Forex (FX)

Forex traders use various analysis techniques to find the best entry and exit points for their trades. Forex exists so that large amounts of one currency can be exchanged for the equivalent value in another currency at the current market rate.

Some of these trades occur because financial institutions, companies, or individuals have a business need to exchange one currency for another. For example, an American company may trade U.S. dollars for Japanese yen in order to pay for merchandise that has been ordered from Japan and is payable in yen.

Forex Pairs and Quotes

Currencies being traded are listed in pairs, such as USD/CAD, EUR/USD, or USD/JPY. These represent the U.S. dollar (USD) versus the Canadian dollar (CAD), the Euro (EUR) versus the USD, and the USD versus the Japanese Yen (JPY), respectively.

In the forex market, currencies trade in lots called micro, mini, and standard lots. A micro lot is 1,000 units of a given currency, a mini lot is 10,000, and a standard lot is 100,000.

The forex market is unique for several reasons, the main one being its size. Trading volume is generally very large. The Forex market trades over $5 trillion per day compared to $200 billion for the equities market.

The largest foreign exchange markets are located in major global financial centers including London, New York, Singapore, Tokyo, Frankfurt, Hong Kong, and Sydney.

How to Trade Forex

The forex market is open 24 hours a day, five days a week, in major financial centers across the globe. This means that you can buy or sell currencies at virtually any hour.

In the past, forex trading was largely limited to governments, large companies, and hedge funds. Now, anyone can trade on forex. Many investment firms, banks, and retail brokers allow individuals to open accounts and trade currencies.

Spot Transactions

A spot market deal is for immediate delivery, which is defined as two business days for most currency pairs. The major exception is the purchase or sale of USD/CAD, which is settled in one business day.

Forex Rollover

Retail traders don't typically want to take delivery of the currencies they buy. They are only interested in profiting from the difference between their transaction prices. Because of this, most retail brokers will automatically roll over their currency positions at 5 p.m. EST each day.

Forex Forward Transactions

Any forex transaction that settles for a date later than spot is considered a forward. The price is calculated by adjusting the spot rate to account for the difference in interest rates between the two currencies. The amount of adjustment is called ""forward points.""

Forex Futures

A forex or currency futures contract is an agreement between two parties to deliver a set amount of currency at a set date, called the expiry, in the future. Futures contracts are traded on an exchange for set values of currency and with set expiry dates.

How Forex Differs From Other Markets

There are some major differences between the way the forex operates and other markets such as the U.S. stock market.

Example of Forex Transactions

Assume a trader believes that the EUR will appreciate against the USD. Another way of thinking of it is that the USD will fall relative to the EUR.

Is Forex Trading for Beginners?

Forex trading can be risky and complex, involving quick decisions due to how fast exchange rates change. It is likely not suited for beginner traders; however, traders can spend time learning forex trading with test trading or with low levels of capital.

How Much Do You Need to Start Trading Forex?

You can start trading Forex with around $100. This will be enough to get you started in buying and selling currencies. It is also a good level for beginners as it isn't a very large amount of capital to lose.

What Are the Risks of Forex Trading?

There are many risks to forex trading. Exchange rates are very volatile, changing often, which could quickly impact a trade. There is also a significant amount of leverage involved in FX, meaning small movements can result in large losses. Additionally, there is transaction risk, interest rate risk, and country risk.

The Bottom Line

<<<<<<< Updated upstream
Forex is foreign exchange, which refers to the global trading of currencies and currency derivatives. It is the largest financial market in the world, involving the buying and selling of currencies in pairs, taking advantage of changing rates.""","The article provides an in-depth explanation of Forex (FX), the global electronic marketplace for trading international currencies and currency derivatives. With no central physical location, the Forex market is the largest and most liquid market globally, trading trillions of dollars daily. It operates 24 hours a day, five days a week—excluding holidays. Institutions, businesses, and individuals engage in Forex trading for multiple reasons, including commercial needs and speculative opportunities. Trades occur in currency pairs, like USD/CAD, EUR/USD or USD/JPY, and in specific lots (micro, mini, and standard). While Forex trading was traditionally the domain of governments, large companies, and hedge funds, now, retail brokers permit individuals to open accounts and trade. Trades can be immediate (spot transactions), held for future dates (forwards), or settled via contracts (futures). Forex trading carries several risks, including volatile exchange rates, leverage, and varying interest rates, and may not be suitable for beginners. Starting capital for Forex trading can be as low as $100.",https://www.investopedia.com/terms/f/forex.asp
=======
Forex is foreign exchange, which refers to the global trading of currencies and currency derivatives. It is the largest financial market in the world, involving the buying and selling of currencies in pairs, taking advantage of changing rates.""","The article dives into the meaning and workings of Forex (FX), which stands for foreign exchange. It refers to the global digital marketplace for trading international currencies and its derivatives. As it functions around the clock five days a week, Forex has become the world's largest and most liquid trading market, with trillions of dollars exchanged daily. Trading mainly happens through banks, brokers, and financial institutions. The currencies are usually traded in pairs like USD/CAD, EUR/USD, and USD/JPY, in lots, including micro, mini, and standard sorts, containing 1,000, 10,000, and 100,000 units respectively. Besides, the Forex market significantly surpasses the equities market trading over $5 trillion per day compared to $200 billion in equities. Traders can participate in Forex trading from anywhere, thanks to its presence in major financial centers globally. Most retail traders aim to profit from transaction price differences rather than take delivery of purchased currencies. The article also highlights some risks of Forex Trading, like the volatility of exchange rates and involvement of substantial leverage, which could lead to significant losses.",https://www.investopedia.com/terms/f/forex.asp
>>>>>>> Stashed changes
33,40,40,"""What Is Diversification? Definition as Investing Strategy

Diversification is a risk management strategy that creates a mix of various investments within a portfolio. A diversified portfolio contains a mix of distinct asset types and investment vehicles in an attempt to limit exposure to any single asset or risk. 

Key Takeaways

Diversification is a strategy that mixes a wide variety of investments within a portfolio in an attempt to reduce portfolio risk.
Diversification is most often done by investing in different asset classes such as stocks, bonds, real estate, or cryptocurrency.
Diversification can also be achieved by purchasing investments in different countries, industries, sizes of companies, or term lengths for income-generating investments.
The quality of diversification in a portfolio is most often measured by analyzing the correlation coefficient of pairs of assets.
Investors can diversify on their own by investing in select investments or can hold diversified funds.

Understanding Diversification

Studies and mathematical models have shown that maintaining a well-diversified portfolio of 25 to 30 stocks yields the most cost-effective level of risk reduction. Investing in more securities generates further diversification benefits, but it does so at a substantially diminishing rate of effectiveness.

Diversification strives to smooth out unsystematic risk events in a portfolio, so the positive performance of some investments neutralizes the negative performance of others. The benefits of diversification hold only if the securities in the portfolio are not perfectly correlated—that is, they respond differently, often in opposing ways, to market influences.

Diversification Strategies

As investors consider ways to diversify their holdings, there are dozens of strategies to implement. Many of the methods below can be combined to enhance the level of diversification within a single portfolio.

Asset Classes

Fund managers and investors often diversify their investments across asset classes and determine what percentages of the portfolio to allocate to each. Each asset class has a different, unique set of risks and opportunities. 

Industries/Sectors

There are tremendous differences in the way different industries or sectors operate. As investors diversify across various industries, they become less likely to be impacted by sector-specific risk.

Market Capitalizations (Large vs. Small)

Investors may want to consider investing across different securities based on the underlying market capitalization of the asset or company. 

Risk Profiles

Across almost every asset class, investors can choose the underlying risk profile of the security. For example, consider fixed-income securities. An investor can choose to buy bonds from the top-rated governments in the world or from nearly defunct private companies raising emergency funds. There are considerable differences between several 10-year bonds based on the issuer, their credit rating, future operational outlook, and existing level of debt.

Maturity Lengths

Specific to fixed-income securities such as bonds, different term lengths impact risk profiles. Generally, the longer the maturity, the higher the risk of fluctuations in the bond's prices due to changes in interest rates. 

Physical Locations (Foreign vs. Domestic)

Investors can reap further diversification benefits by investing in foreign securities. For example, forces depressing the U.S. economy may not affect Japan's economy in the same way. Therefore, holding Japanese stocks gives an investor a small cushion of protection against losses during an American economic downturn.

Pros and Cons of Diversification

The primary purpose of diversification is to mitigate risk. By spreading your investment across different asset classes, industries, or maturities, you are less likely to experience market shocks that impact every single one of your investments the same.

However, there are drawbacks to diversification. The more holdings a portfolio has, the more time-consuming it can be to manage—and the more expensive, since buying and selling many different holdings incurs more transaction fees and brokerage commissions. More fundamentally, diversification's spreading-out strategy works both ways, lessening the risk and the reward.

Diversifiable vs. Non-Diversifiable Risk

The idea behind diversification is to minimize (or even eliminate) risk within a portfolio. However, there are certain types of risks you can diversify away, and certain types of risks exist regardless of how you diversify. These types of risks are called unsystematic and systematic risks.

Measuring Diversification

It can become complex and cumbersome to measure how diversified a portfolio is. In reality, it is impossible to calculate the actual degree of diversification; there are simply too many variables to consider across too many assets to truly quantify a single measure of diversification. Still, analysts and portfolio managers use several measurements to get a rough idea of how diversified a portfolio is.

Correlation Coefficient

A correlation coefficient is a statistical measurement that compares the relationship between two variables. This statistical calculation tracks the movement of two assets and whether the assets tend to move in the same direction. 

Standard Deviation

Standard deviation (SD) measures how often and far an outcome occurs away from the mean. For investments, standard deviation measures how far away from an asset's average return other returns fall. Analysts use SD to estimate risk based on return frequency.

Example of Diversification

Imagine an aggressive investor, who can assume a higher risk level, wishes to construct a portfolio composed of Japanese equities, Australian bonds, and cotton futures. They could purchase stakes in the iShares MSCI Japan ETF, the Vanguard Australian Government Bond Index ETF, and the iPath Bloomberg Cotton Subindex Total Return ETN.

The Bottom Line

<<<<<<< Updated upstream
Diversification is a very important concept in financial planning and investment management. It is the idea that by investing in different things, the overall risk of your portfolio is lower. With the ease of transacting and investing online, it is now incredibly easy to diversify your portfolio through different asset classes and other strategies.""","The article discusses the concept and strategies of diversification in investing. Diversification is an approach to risk management that involves making a variety of investments within a portfolio to limit exposure to any single asset or risk. This is often done by investing in different asset classes, such as stocks, bonds, real estate, and cryptocurrency. Other diversification strategies include investing in different countries, industries, company sizes, and term lengths for income-generating investments. 

The quality of diversification is often gauged by analyzing the correlation coefficient of pairs of assets. Studies suggest that a well-diversified portfolio of 25 to 30 stocks offers a cost-effective level of risk reduction. Diversification aims to balance out unsystematic risk events in a portfolio, so the positive performance of some investments offsets the negative performance of others.

While the primary purpose of diversification is to reduce risk, it also has its drawbacks. It can be time-consuming to manage numerous holdings and can incur more transaction fees and brokerage commissions. Also, diversification can limit both risk and reward due to its spreading-out strategy. Despite the complexity of measuring diversification, analysts and portfolio managers use several metrics to get a rough idea of how diversified a portfolio is, like correlation coefficient and standard deviation. For investors willing to assume higher levels of risk, diversification can also include investments in foreign securities, thereby increasing potential for higher returns.",https://www.investopedia.com/terms/d/diversification.asp
=======
Diversification is a very important concept in financial planning and investment management. It is the idea that by investing in different things, the overall risk of your portfolio is lower. With the ease of transacting and investing online, it is now incredibly easy to diversify your portfolio through different asset classes and other strategies.""","The article defines diversification as a key investment strategy designed to minimize risk by investing in a variety of distinct asset types and investment vehicles. This approach aims to reduce the potential negative impact that any single investment might have on a portfolio. Diversification can be achieved through investment in different asset classes, countries, industries, company sizes or term lengths for income-generating investments. The effectiveness of diversification is often measured by analyzing the correlation coefficient of pairs of assets. Diversification has its pros, such as mitigating risk; however, it also has its cons, such as increasing transaction fees and brokerage commissions due to larger portfolio holdings. Additionally, it's important to understand the difference between diversifiable (unsystematic) and non-diversifiable (systematic) risk. Tools such as the correlation coefficient and standard deviation are often used to measure how well a portfolio is diversified. The article presents an example of an aggressive investor who diversifies their portfolio with Japanese equities, Australian bonds, and cotton futures. The essence of diversification is fundamentally lowering portfolio risk by investing in a variety of assets.",https://www.investopedia.com/terms/d/diversification.asp
>>>>>>> Stashed changes
34,43,43,"""What Is Asset Allocation and Why Is It Important?

Asset allocation is how investors divide their portfolios among different assets that might include equities, fixed-income assets, and cash and its equivalents. Investors ordinarily aim to balance risks and rewards based on financial goals, risk tolerance, and the investment horizon.

Key Takeaways

Asset allocation is how investors split up their portfolios among different kinds of assets.
The three main asset classes are equities, fixed income, and cash and cash equivalents.
Each asset class has different risks and return potential, so each will behave differently over time.
No simple formula can find the right asset allocation for every individual investor.

Why Is Asset Allocation Important?

There's no formula for the right asset allocation for everyone, but the consensus among most financial professionals is that asset allocation is one of the most important decisions investors make.

Selecting individual securities within an asset class is done only after you decide how to divide your investments among stocks, bonds, and cash and cash equivalents. This will largely determine your investment results.

Investors use different asset allocations for distinct goals. Risk tolerance plays a key factor as well. 

Age-Based Asset Allocation

Financial advisors generally recommend holding stocks for five years or longer. Portfolios should generally move to a more conservative asset allocation to help lower risk as individuals approach retirement.

Asset Allocation Through Life-Cycle Funds

Some asset-allocation mutual funds are known as life-cycle or target-date funds. They set out to provide investors with portfolios that address their age, risk appetite, and investment goals with the correlated parts of different asset classes. These funds gradually reduce the risk in their portfolios as they near the target date.

How Do Economic Changes Affect Asset Allocation Strategies?

Economic cycles of growth and contraction greatly affect how you should allocate your assets. During bull markets, investors ordinarily prefer growth-oriented assets like stocks. Alternatively, during downturns or recessions, investors tend to shift toward more conservative investments, which can help preserve capital.

How Does Behavioral Finance View Asset Allocation?

Behavioral finance explores how common cognitive errors might influence our financial choices. For our asset allocation, we might be swayed too much by recent market trends, overconfidence, sunk-cost reasoning, or loss aversion, which can lead to less beneficial allocation choices. 

The Bottom Line

<<<<<<< Updated upstream
Most financial professionals will tell you that asset allocation is one of the most important decisions investors can make. The selection of individual securities is secondary to how assets are allocated in stocks, bonds, and cash and cash equivalents, which will play more of a role in your investment results.""","Asset allocation refers to the process by which investors divide their portfolios among various assets such as equities, fixed-income assets, and cash equivalents. This strategy aims to balance risks and rewards in line with the investor's financial objectives, risk tolerance, and investment timeline. The primary asset classes include equities, fixed income, and cash equivalents, each with its own risk and return potential. There's no universal formula for optimal asset allocation, making it a crucial and personalized step in investment decision-making.

The importance of asset allocation is broadly acknowledged among financial professionals since it directly impacts investment results. Investors may prefer different asset allocations for different goals, influenced by their risk tolerance. As investors near retirement age, financial advisors often suggest a shift towards more conservative asset allocations. 

Asset allocation mutual funds, like life-cycle or target-date funds, are tailored according to the investor's age, risk tolerance, and investment objective, with risk reduction strategies implemented as the target date nears. 

Moreover, asset allocation strategies are influenced by economic cycles. In bull market periods, investors commonly prefer growth-oriented assets, whereas conservative investment choices are more popular during downturns to help preserve capital. Cognitive errors, as explored by behavioral finance, may sway investors and result in suboptimal asset allocation decisions. Therefore, despite the selection of individual securities, the way assets are allocated in stocks, bonds, and cash equivalents predominantly determines investment outcomes.",https://www.investopedia.com/terms/a/assetallocation.asp
=======
Most financial professionals will tell you that asset allocation is one of the most important decisions investors can make. The selection of individual securities is secondary to how assets are allocated in stocks, bonds, and cash and cash equivalents, which will play more of a role in your investment results.""","Asset allocation is a strategy that investors use to divide their portfolios among various assets such as equities, fixed-income assets, and cash and its equivalents. This financial strategy is essential because it aids investors in balancing risks and rewards based on their financial objectives, risk tolerance, and investment timeline. There are three primary asset classes: equities, fixed income, and cash and cash equivalents, each carrying distinct risks and return potentials. While there is no uniform formula for asset allocation, it is universally agreed upon that it is critical in investment decision-making. This strategy is individually tailored according to the investor's age, risk appetite, and investment goals. Professionals generally advise a more conservative asset allocation as individuals near retirement, reducing risk through life-cycle funds. Economic cycles also impact these strategies; during growth phases, investors lean more towards growth-oriented assets, and more conservative investments during downturns. A caveat, behavioral finance highlights that cognitive errors like overconfidence or loss aversion can negatively influence asset allocation decisions. The ultimate takeaway is that asset allocation significantly influences investment results, more so than the selection of individual securities.
",https://www.investopedia.com/terms/a/assetallocation.asp
>>>>>>> Stashed changes
